id,date,message,from_id,chat_id,views,forwards
36855,2024-08-26T19:54:39+00:00, Ukraine preparing to respond to Russian mass attack with weapons of domestic production defense minister saysShortly before President Volodymyr Zelensky revealed that Ukraine has developed a new missiledrone Palianytsia,,1659203053,748,4
36854,2024-08-26T18:39:41+00:00,Russia has launched largest attack on Ukraine since start of fullscale invasion Air Force reportsRussia launched 127 missiles and 109 drones while Ukraine downed 102 missiles and 99 drones according to the Air Force Russian strikes hit several civilian energy and fuel facilities including a dam in Kyiv part of the Kyiv Hydroelectric Power Plant,,1659203053,1909,10
36853,2024-08-26T18:34:24+00:00,Morning Russian mass attack kills 7 injures nearly 50Russias mass missile and drone attack on Aug 26 killed seven people and injured 47 others including four children the State Emergency Service reported after rescue operations were completedRussia launched 127 missiles and 109 drones the largest attack on Ukraine since the beginning of the fullscale invasion in 2022 Ukraines Air Force said Ukraine downed 102 missiles and 99 drones,,1659203053,1964,4
36852,2024-08-26T18:04:38+00:00,Opinion Ukraines oligarchs were once kingmakers Where are they nowUkraines oligarchs once dominant power brokers have seen their influence wane amid war reforms and shifting economic realities raising questions about the future of the countrys political landscape writes KI Insights Director Jakub Parusinski in his recent oped KI Insights subscribers can attend an online deepdive briefing on the current state of Ukraines oligarchs by registering herePhoto Yan DobronosovGlobal Images Ukraine via Getty Images,,1659203053,2164,3
36851,2024-08-26T17:17:22+00:00,IAEA chief to visit Russias Kursk Nuclear Power Plant on Aug 27The Kursk Nuclear Power Plant is located nearly 80 kilometers 49 miles from the town of Sudzha which was captured by Ukrainian forces in midAugust during Kyivs ongoing incursion into Kursk Oblast,,1659203053,2392,2
36850,2024-08-26T17:03:26+00:00,Arrest of Russianborn Telegram CEO not a political decision Macron saysThe recent arrest of Pavel Durov the Russianborn CEO of the messaging app Telegram was in no way a political decision French President Emmanuel Macron said in a statement on Aug 26Durov was arrested at Le Bourget airport on the outskirts of Paris on Aug 24 after landing in his private jet,,1659203053,2531,6
36849,2024-08-26T17:01:08+00:00,Reuters journalist injured in Kramatorsk hotel strike in serious conditionReuters camera operator Ivan LubyshKirdey is unconscious after sustaining serious injuries from Russias Aug 24 strike on a hotel in Kramatorsk his wife Mariia Semenchenko said on Aug 26The strike on the Safir Sapphire Hotel in Kramatorsk in Donetsk Oblast killed British national Ryan Evans a security adviser for Reuters and injured six others including two local female residents,,1659203053,2511,2
36848,2024-08-26T15:40:13+00:00,Opinion AI complacency is compromising Western defenseWestern defense systems are faltering as outdated strategies fail to keep pace with the rise of inexpensive AIpowered drones and advanced technologies from adversaries writes policy analyst Charles Fergusson in his latest opedRead the full oped herePhoto Sergey Bobok  AFP via Getty Images,,1659203053,2972,6
36847,2024-08-26T14:19:12+00:00,Negotiations with Ukraine have now lost their relevance Kremlin says Kremlin spokespersons statement comes amid an ongoing Ukrainian incursion in Russias Kursk Oblast which started in early August,,1659203053,3432,5
36846,2024-08-26T14:08:02+00:00,Wagner Group claims to no longer be fighting in UkraineWagner mercenaries are operating only in Belarus and Africa and are not fighting alongside the Russian army in Ukraine the Wagner Group claimed in a statement on Telegram on Aug 26The statement which was posted on a Wagneraffiliated Telegram channel claimed that there are no subordinates of the company either in Rosgvardia Russias National Guard or in the ranks of the Russian Defense Ministry or anywhere else,,1659203053,3464,5
36845,2024-08-26T13:06:01+00:00,Drone possibly flew into Polish territory during mass Russian attack on Ukraine Polish military saysAn unidentified airborne object likely a drone probably flew into Polish territory in the morning of Aug 26 amid a mass Russian attack across Ukraine Polish military officials said,,1659203053,3836,6
36844,2024-08-26T12:41:20+00:00,Official Russian missile attack killed 5 injured 30A massive Russian missile and drone attack killed at least five people and injured at least 30 across Ukraine on Aug 26 Oleksandr Khorunzhy spokesperson for the State Emergency Service said on national television,,1659203053,3886,5
36843,2024-08-26T12:21:30+00:00,Kyiv hydroelectric dam hit during massive Russian attack across Ukraine aide saysA dam in Kyiv part of the Kyiv Hydroelectric Power Plant was struck during a massive Russian attack across Ukraine on Aug 26 Timofiy Mylovanov an advisor at the Presidents Office said,,1659203053,3935,7
36842,2024-08-26T10:28:31+00:00,Explosion at oil refinery in Russian city of Omsk injures 2An explosion at a refinery owned by staterun energy giant Gazprom in the Russian city of Omsk on Aug 26 injured at least two people the companys press service reported,,1659203053,4369,5
36841,2024-08-26T10:12:37+00:00,Zelensky Russia attacked Ukraine with over 100 missiles about 100 dronesRussia attacked Ukraine with over 100 missiles and about 100 Shahed drones on the morning of Aug 26 President Volodymyr Zelensky said on Telegram,,1659203053,4625,10
36840,2024-08-26T09:47:26+00:00,These are the indicative estimates of Russias combat losses as of August 26 according to the Armed Forces of Ukraine,,1659203053,4450,7
36839,2024-08-26T08:12:07+00:00,After a decadelong battle Kyiv showcases Crimean treasures that Russia wanted to steal Following a decadelong battle a substantial part of Crimean artifacts is now on display in Kyiv until the occupied peninsula is liberated officials sayAfter a lengthy legal struggle the return of the socalled Scythian gold last year was for Ukrainians an important cultural milestone amid the ongoing decadelong war with Russia A collection of 565 artifacts or 2111 items was finally returned to Ukrainiancontrolled territoryPhoto Kaniuka RuslanGetty Images,,1659203053,4566,7
36838,2024-08-26T08:11:37+00:00,Russian missile attack kills at least 4 across UkraineA massive Russian missile and drone attack killed at least four people in Volyn Dnipropetrovsk Zaporizhzhia and Zhytomyr oblasts on Aug 26 according to local authorities,,1659203053,4355,5
36837,2024-08-26T08:01:02+00:00,Ukrainian soldiers reportedly down Russian cruise missile with truckmounted machine gun in Zakarpattia OblastUkrainian soldiers from an air defense unit in western Zakarpattia Oblast downed a Russian cruise missile with a truckmounted machine gun according to a video shared by Governor Viktor Mykyta on Aug 26,,1659203053,4348,7
36836,2024-08-26T07:15:52+00:00,Poland says jets scrambled amid massive Russian strikes across UkraineThe Operational Command of the Polish Armed Forces warned residents on Aug 26 that Polish and other allied jets were active in the southeastern part of the country amid a massive wave of Russian attacks across Ukraine,,1659203053,4597,6
36835,2024-08-26T06:40:00+00:00,Mayor 1 person killed in Lutsk as Russia launches massive missile attackA Russian missile attack killed one person in the city of Lutsk in Volyn Oblast and damaged an apartment building and an infrastructure facility on Aug 26 Lutsk Mayor Ihor Polishchuk said on Telegram,,1659203053,4643,4
36834,2024-08-26T06:28:12+00:00,Blackouts reported across Ukraine as Russia attacks energy infrastructureDTEK Ukraines largest private energy company said on Aug 26 that emergency power shutdowns were in place across Ukraine Kyiv Mayor Vitali Klitschko said there were power outages in several districts of the capital and later added there were problems with the water supply on the right bank of the city,,1659203053,4638,8
36833,2024-08-26T05:55:17+00:00,Explosions reported in cities across Ukraine as Russia launches massive missile attackExplosions were reported on Aug 26 in Kyiv Kharkiv Odesa Vinnytsia Zaporizhzhia Kremenchuk Dnipro Khmelnytskyi Kropyvnytskyi Lutsk and Kryvyi Rih,,1659203053,4783,16
36832,2024-08-26T05:37:34+00:00,Russian authorities claim Saratov Oblast attacked by drones 4 injured Drones reportedly struck Russias Saratov Oblast overnight on Aug 26 Russian authorities reported in the morning At least four civilians were injured in the attack that caused damage to buildings and led to flight restrictions in the regionThe drones reportedly targeted Saratov and Engels home to a Russian air force base There was no immediate information on damage at the base which is often used by Russia to attack Ukraine,,1659203053,4699,5
36831,2024-08-26T05:32:45+00:00,Russia launches mass missile attack explosions heard in KyivExplosions were heard in Kyiv on Aug 26 as Russia launched a mass missile attack on Ukraine,,1659203053,4750,6
36830,2024-08-26T04:25:30+00:00,Ukraine has captured over 240 Russian soldiers during its Kursk incursion WP reports Ukraine has apparently captured at least 247 Russian soldiers since its incursion into Russias Kursk Oblast began on Aug 6 according to the Washington Post WP analysis of visual evidence,,1659203053,4735,5
36829,2024-08-26T03:02:14+00:00,UPDATE Reuters safety adviser killed 6 others injured in Kramatorsk strike Ryan Evans a member of the Reuters team reporting on the war in Ukraine was killed and two other Reuters journalists were injured in a Russian missile strike on Kramatorsk that occurred late at night on Aug 24 the news agency said,,1659203053,4779,7
36828,2024-08-26T02:16:35+00:00,French authorities extend detention of Telegram CEO Pavel Durov French judicial authorities on Aug 25 extended the detention of Pavel Durov the Russianborn founder of Telegram following his arrest over alleged offenses linked to the messaging appIn a statement released on Aug 25 via X Telegram said Telegram abides by EU laws including the Digital Services Actits moderation is within industry standards and constantly improvingTelegrams CEO Pavel Durov has nothing to hide and travels regularly throughout Europe It is absurd to claim that a platform or its owner are responsible for abuse of that platform Were awaiting a prompt resolution of this situation,,1659203053,4835,5
36827,2024-08-25T23:55:31+00:00,Zelensky expresses support for India hosting Ukraines second peace summit President Volodymyr Zelensky said on Aug 25 that negotiations are ongoing with Saudi Arabia Qatar Turkey and Switzerland to organize a second peace summit In a conversation with Indian journalists Zelensky revealed that he had informed Indias Prime Minister Narendra Modi of his support for India hosting the summit,,1659203053,4674,8
36825,2024-08-25T20:42:44+00:00,3 killed 6 injured in Russian attacks on Sumy OblastRussian forces struck Sumy Oblast 229 times on Aug 25 killing three people and injuring six others the Sumy Oblast Military Administration said,,1659203053,4831,4
36824,2024-08-25T20:18:51+00:00,Ukraine war latest Kyivs new Palianytsia missiledrone pictured for first timeUkraine has released the first images of its new Palianytsia missiledrone designed to strike Russian military airfields and destroy the enemys offensive potentialOne British journalist has been killed and another six people have been injured in a Russian missile attack on Kramatorsk that occurred late at night on Aug 24 Ukraines National Police confirmedRead todays full report herePhoto Anatolii StepanovAFP via Getty Images,,1659203053,4922,4
36823,2024-08-25T20:14:33+00:00,Ukraine advances another 13 km captures 2 more settlements in Russias Kursk Oblast Zelensky saysUkrainian forces have advanced 1 to 3 kilometers in some areas of Russias Kursk Oblast capturing two more settlements in the region President Volodymyr Zelensky said in his evening address on Aug 25Zelensky who received the information from Commanderinchief Oleksandr Syrskyi did not detail which settlements were captured by Ukrainian forces but did note that fighting is ongoing to capture one additional settlement,,1659203053,4657,6
36822,2024-08-25T19:23:59+00:00,Belarus gathering significant number of troops weaponry along Ukraines border under guise of exercises Ukraine saysBelarus Armed Forces are concentrating a significant number of personnel as well as weaponry along Ukraines northern border with Belarus under the guise of exercises Ukraines Foreign Ministry warned on Aug 25 citing information gathered by the countrys intelligence sourcesMinsk is concentrating Special Operation Forces as well as weaponry including tanks artillery multiplelaunch rocket systems MLRS air defense systems and engineering equipment near the Belarussian city of Gomel a statement released by the Foreign Ministry said The city lies within about 30 kilometers of the BelarusUkraine border,,1659203053,4796,17
36821,2024-08-25T18:08:54+00:00,UPDATE 1 journalist killed 6 others injured in Kramatorsk strikeThe body of a 40yearold British journalist was pulled out of the rubble at 635 pm local time on Aug 25 after a lengthy 19hour search the National Police confirmedFour of the injured are Reuters journalists including a Ukrainian and foreigners from the US Latvia and Germany Two of the injured journalists required hospitalizationAnother two local residents were also injured by shelling during the attack,,1659203053,4894,11
36820,2024-08-25T17:22:23+00:00,Controversial Ukrainian MP flees country after being charged with assaulting soldier law enforcement officerControversial Ukrainian Member of Parliament Artem Dmytruk fled the country on Aug 25 after being charged with assaulting a soldier as well as a law enforcement officer in separate altercations the Prosecutor Generals Office announced,,1659203053,4911,8
36819,2024-08-25T16:03:39+00:00, Zelensky Diplomacy not at the expense of 30 of our territoryUkraine is committed to peace but not at the expense of giving up its territory President Volodymyr Zelensky said in a sit down with Indian media representatives on Aug 25,,1659203053,4948,8
36818,2024-08-25T14:05:56+00:00,Kursk operation What Ukraine achieved so far and potential future gainsUkraines ongoing operation in Russias Kursk Oblast a bold incursion launched nearly three weeks ago that surprised Moscow and the world alike has already yielded some tangible military and political results while also raising hopes for a sooner end to Russias fullscale invasionThe Kursk incursion has allowed Ukraine to set a precedent for further offensive actions It has created conditions for returning more Ukrainian prisoners of war by capturing scores of Russian POWs The first major invasion of Russia since World War II has also dealt a blow to Russian President Vladimir Putins reputation while lifting the spirits of Ukrainian soldiers and civiliansPhoto Kostiantyn LiberovLibkosGetty Images,,1659203053,5170,7
36817,2024-08-25T13:15:40+00:00, Pope Francis criticizes push to ban activities of Russianaffiliated religious organizations in Ukraine Pope Francis criticized Kyivs move to potentially ban the activities of Russianaffiliated religious organizations in Ukraine amid the war saying that churches are not to be touched,,1659203053,4965,10
36816,2024-08-25T12:11:35+00:00, Ukrainian boxer Usyk says he has no interest in entering politicsUkrainian boxer Oleksandr Usyk has no interest in entering politics he said in an interview with NV on Aug 24I wont leave boxing  it will always be with me I will work in boxing I will help boxing Its a part of my life Usyk said,,1659203053,5138,2
36815,2024-08-25T11:59:04+00:00, UPDATE 4 injured in Kramatorsk strike governor saysThe number of people injured in the Russian missile strike on Kramatorsk has risen to four according to Donetsk Oblast Governor Vadym FilashkinAll of the injured are reportedly Reuters journalists from Ukraine the US Latvia and Germany,,1659203053,5160,3
36814,2024-08-25T10:33:34+00:00,4 dead 13 wounded during Russian strikes on Sumy Oblast on Aug 24The security situation in Sumy Oblast has become more tense with the start of Ukraines crossborder incursion into neighboring Kursk Oblast,,1659203053,5148,2
36813,2024-08-25T08:57:39+00:00, Ukraines new Palianytsia missiledrone pictured for first timeA new video says that almost everything about the Palianytsia is classified but does reveal some new information,,1659203053,5131,8
36812,2024-08-25T07:37:13+00:00,These are the indicative estimates of Russias combat losses as of August 25 according to the Armed Forces of Ukraine,,1659203053,5316,6
36811,2024-08-25T07:13:57+00:00, British American Ukrainian journalists among those injured in Russian strike on Kramatorsk hotelTwo journalists have been injured and another is trapped under rubble Donetsk Oblast Governor Vadym Filashkin said in a post on Telegram,,1659203053,5217,9
36810,2024-08-25T03:03:58+00:00,August 24 prisoner exchange did not include any Azov soldiers brigade commander says Azov Regiment commander Denys Prokopenko criticized the recent prisoner exchange expressing disappointment that none of the Azov fighters who have been in Russian captivity for over two years were included,,1659203053,5418,10
36809,2024-08-25T00:40:49+00:00,Zelensky praises new Ukrainianmade Palianytsia missiles President Volodymyr Zelensky stated that Ukraines new military advancements particularly the Palianytsia missile are a critical way for the country to act amid delays in decisionmaking by some of its international partners Today the first and successful combat use of our new weapon took place he said An absolutely new class of weapon of the Ukrainian missiledrone Palianytsia,,1659203053,5376,10
36808,2024-08-24T23:14:53+00:00,Telegram CEO Pavel Durov arrested at French airport Durov was arrested at Le Bourget airport outside of Paris while traveling on his private jet Reports by French network TF1 suggest that he was wanted in France due to an investigation into Telegrams lack of moderation which authorities believe has enabled criminal activities to continue on the platform,,1659203053,5287,29
36807,2024-08-24T21:34:53+00:00,Opinion The heavy weight of Ukrainian cultureWhile we might wish for our culture to be positive and light our history is what it is writes a Ukrainian writer Khrystia Vengryniuk in this opedWe must speak about how Russia has been killing us for centuries and continues to do so Yes it will be painful and sad for us to read and reread chronicles diaries memoirs and fiction about the war just as it will be painful to watch theatrical performances and films and listen to songs about this time but this is our bloody history and we have no other choice Read the full oped herePhoto Kaniuka RuslanUkrinformFuture Publishing via Getty Images,,1659203053,5129,7
36806,2024-08-24T21:29:19+00:00,Russian missile attack on Sumy injures 7Russian forces struck the regional center of Sumy in Sumy Oblast on Aug 24 injuring seven people the local military administration reportedTwo people are currently in a serious condition according to the report,,1659203053,4737,1
36805,2024-08-24T21:28:48+00:00,Kyiv denies talks held with Russia to stop strikes on energy infrastructureEnergy Minister Herman Halushchenko denied any indirect negotiations with Russia to stop attacks on Ukrainian energy infrastructure had taken place in an interview on national television on Aug 24We are not negotiating with the terrorists that is for sure especially not behind the scenes It is impossible Of course we did not conduct these negotiations with the Russians Halushchenko said,,1659203053,4860,4
36804,2024-08-24T21:28:22+00:00,Poland to replace ambassador to Ukraine on Sep 1Piotr Lukasiewicz will become the new Polish ambassador to Ukraine on Sep 1 Polish news outlet RMF reported on Aug 24 citing Polish Foreign Ministry spokesperson Pawel WronskiIn March the Polish Foreign Ministry announced that over 50 ambassadors would terminate their missions and that more than a dozen candidates submitted for approval by the previous ministry leadership would be withdrawn,,1659203053,4768,3
36803,2024-08-24T19:39:08+00:00,Lithuania announces new military aid package including drones air defense missilesLithuanian Prime Minister Ingrida Simonyte announced on Aug 24 a new aid package for Ukraine which includes drones air defense missiles and funds to purchase military equipmentSimonyte and Polish President Andrzej Duda visited Kyiv on Ukraines Independence Day,,1659203053,4776,3
36802,2024-08-24T18:48:46+00:00,Opinion On Independence Day a playlist in honor of musicians who defend UkraineOn the occasion of Ukraines 33rd Independence Day celebrated on Aug 24 Daria Kolomiec a Ukrainian cultural activist created a playlist dedicated to Ukrainian soldiers It features 33 songs by those involved in defending our independence Thanks to them we still live in a free country after all these 33 years writes Kolomiec Read more here,,1659203053,4892,14
36801,2024-08-24T18:43:15+00:00,Operation in Kursk Oblast prevents Russias attempts to occupy Sumy Zelensky saysUkraines operation in Russias Kursk Oblast has helped prevent the occupation of Sumy Oblast and its regional center the city of Sumy President Volodymyr Zelensky said at a press conference on Aug 24Ukraine started its incursion into Russias Kursk Oblast on Aug 6 As of Aug 20 the Ukrainian military said it controlled 1263 square kilometers 488 square miles and 93 settlements including the town of Sudzha,,1659203053,4850,7
36800,2024-08-24T17:30:44+00:00,Ukrainian hackers launch largescale cyberattack on Russian Internet providers militaryrelated companies source saysHackers of Ukraines military intelligence agency HUR carried out on Aug 24 a mass cyberattack on the servers of Russian Internet providers and blocked dozens of online platforms of industrial facilities in Russia a military intelligence source told the Kyiv IndependentThe recent attack affected at least 33 servers and 283 office computers at industrial facilities took down 21 websites and destroyed 15 cloud and file storages Ukrainian hackers also left proUkrainian messages on the affected online platforms according to the source,,1659203053,4638,11
36799,2024-08-24T16:28:57+00:00,How Ukraines military has changed since it last paraded through the streets of KyivOn Aug 24 2021 Ukraines military finest paraded through the streets of Kyiv in celebration of the 30th anniversary of the countrys Independence DayIt would be the last time such an event was held with Russias fullscale invasion meaning everything on display would be put to the test with the fate of the entire country resting on the shoulders of those who took partToday Ukraines military looks vastly different to that which paraded through the streets of Kyiv in 2021Read the full analysis herePhoto Volodymyr Tarasov UkrinformFuture Publishing via Getty Images,,1659203053,4777,5
36798,2024-08-24T15:57:04+00:00,Polish President Duda Lithuanian PM Simonyte make remarks from Kyiv on Independence DayPolish President Andrzej Duda and Lithuanian Prime Minister Ingrida Simonyte spoke in Kyiv alongside President Volodymyr Zelensky on Ukraines Independence Day on Aug 24,,1659203053,4646,3
36797,2024-08-24T14:29:51+00:00,Russian attack in Donetsk Oblast town Kostiantynivka kills 5 at least 5 injuredFive civilians were killed and another five were injured in a Russian attack on the Donetsk Oblast town of Kostiantynivka in the morning of Aug 24 local authorities said,,1659203053,4755,3
36793,2024-08-24T13:36:40+00:00,Today Ukrainians worldwide stand tall with immense pride celebrating 33 years of Ukraines independenceThe Kyiv Independent team invites you to stand with us and celebrate by embracing our curated merchandise now with a special 24 discountThe items featured in the photos are part of our special Independence Day Sale running from Aug 24 to Aug 31 Learn more and make a purchase here,,1659203053,4716,4
36792,2024-08-24T13:13:33+00:00,Zelensky signs law potentially banning Moscowlinked churchPresident Volodymyr Zelensky signed a bill on Aug 24 banning activities of religious organizations connected to Russia,,1659203053,4572,2
36791,2024-08-24T11:39:18+00:00,Ukrainian response will reach any point in Russia  Zelenskys Independence Day addressWe know what independence is How difficult it is to revive it How difficult it is to defend it But we know everything depends on us said President Volodymyr Zelensky in his Independence Day address Read the full transcript herePhoto Presidents Office,,1659203053,4851,9
36790,2024-08-24T11:16:34+00:00,115 Ukrainian soldiers returned from Russian captivity Zelensky confirmsPresident Volodymyr Zelensky confirmed on Aug 24 that 115 Ukrainian soldiers were brought back from Russian captivity,,1659203053,4605,6
36789,2024-08-24T11:12:58+00:00,Russia destroys historic house of 20thcentury Ukrainian anarchist revolutionary A Russian strike destroyed the historic house and family estate of the Ukrainian anarchist fighter Nestor Makhno in Huliaipole Zaporizhzhia Oblast the National Police reported on Aug 24The house which served as a museum to the 20thcentury revolutionary burnt to the ground after Russia launched 306 strikes on nine frontline settlements in Zaporizhzhia Oblast overnight on Aug 23,,1659203053,4886,11
