id,date,message,from_id,chat_id,views,forwards
36661,2024-08-20T08:39:34+00:00, Pontoon crossing in Russias Kursk Oblast disappears in possible blast RFERL reportsOne of at least two pontoon bridges built by Russia over the Seim River in Kursk Oblast is no longer visible in satellite imagery and smoke was detected in the area Radio Free EuropeRadio Liberty RFERL reported on Aug 19The news came shortly after Ukraine allegedly struck the third and final stationary bridge over the river in the Glushkovsky district threatening to cut off Russian supply lines in the area amid Kyivs ongoing incursion,,1659203053,4937,6
36660,2024-08-20T07:53:06+00:00,Ukraines military says battles ongoing in NiuYork amid Russias reported advanceThe Ukrainian military said on Aug 20 that clashes are ongoing at the village of NiuYork in Donetsk Oblast as multiple sources point to a rapid Russian advance deep into the settlementNiuYork lies just south of Toretsk a key frontline town that has become one of the focal points of the Russian offensive in Donetsk Oblast,,1659203053,4809,4
36659,2024-08-20T07:10:58+00:00, Russian attacks against Ukraine kill 5 injure 21 over past dayRussian attacks across Ukraine over the past day killed at least five civilians and injured at least 21 including a child regional authorities said early on Aug 20Ukrainian air defenses downed 25 of the 26 Shahedtype kamikaze drones launched by Russia overnight as well as two Kh59 cruise missiles and one IskanderK cruise missile the Air Force saidPhoto Kharkiv Oblast Governor Oleh SyniehubovTelegram,,1659203053,4892,3
36658,2024-08-20T06:10:05+00:00,These are the indicative estimates of Russias combat losses as of Aug 20 according to the Armed Forces of Ukraine,,1659203053,4720,8
36657,2024-08-20T06:04:02+00:00,Kyiv to launch new body for countering Russian influence among Ukrainian diasporaThe Ukrainian government is preparing to launch a new institution that would promote Ukrainian unity abroad and counter Russian influence President Volodymyr Zelensky said on Aug 19Speaking at the meeting of Ukraines senior diplomats Zelensky dubbed the new body the Ministry for Ukrainian Unity and Countering Russian Influence on UkrainiansPhoto Presidential Office,,1659203053,4608,13
36656,2024-08-20T05:54:33+00:00,Democratic convention kicks off with celebrations Biden keynote and few details on UkraineConvention delegates on Aug 19  confirmed the Democrats official party platform The 92page document highlights Bidens stance against Putin and his support of NATO expansion In terms of a future Harris administrations Ukraine policy however the platform is light on detailsThe platform was confirmed by the conventions committee five days before Biden withdrew from the race on July 21 meaning all policies therein reflect plans for a second Biden term The document has yet to be updated since Biden dropped out and endorsed HarrisPhoto Owen RacerThe Kyiv Independent,,1659203053,4819,4
36655,2024-08-20T04:22:56+00:00,No president should bow down to dictators Biden says at Democratic convention Putin thought hed take Kyiv in three days US President Joe Biden said on the first night of the Democratic National Convention Three years later Ukraine is still free,,1659203053,5472,7
36654,2024-08-20T03:04:34+00:00,US support to Ukraine ongoing amid Kursk Oblast incursion Pentagon says US Defense Secretary Lloyd Austin III and Defense Minister Rustem Umerov have discussed ongoing support from allies and partners in helping meet Ukraines urgent military requirements Deputy Pentagon Press Secretary Sabrina Singh said on Aug 19,,1659203053,5700,9
36653,2024-08-20T02:00:55+00:00,Belarus sends more troops aircraft to border with Ukraine Belarus has deployed additional air defense troops and aircraft to its border with Ukraine Maj Gen Andrey Lukyanovich commander of the Belarusian Air Defense Forces announced on Aug 19,,1659203053,5073,8
36652,2024-08-20T00:43:59+00:00,Lithuania starts construction of military base for German troops near Russian border Lithuania on Aug 19 began construction of a military base that will house up to 4000 combatready German troops with completion expected by the end of 2027 This marks the first permanent foreign deployment for the German military since World War II,,1659203053,5825,19
36651,2024-08-19T23:15:42+00:00,Russian attack on Sumy Oblast injures 4 Russian forces attacked 11 communities in Sumy Oblast on Aug 19 injuring four civilians according to the Sumy Oblast Military Administration In total 256 explosions were recorded in 69 separate attacks on the regionThe security situation in Sumy Oblast became more tense with the start of Ukraines crossborder incursion into neighboring Kursk Oblast in Russia which began on Aug 6 Sumy Oblast shares a 245kilometer 152mile border with Kursk region,,1659203053,5089,2
36650,2024-08-19T21:44:35+00:00,Ukraine war latest Ukraine captures 92 settlements in Russias Kursk Oblast Kyiv claimsUkrainian forces are in control of 92 settlements and more than 1250 square kilometers of Kursk Oblast in Russia as the incursion into the region continues President Volodymyr Zelensky said on Aug 19Pokrovsks residents have a week or two to evacuate as Russian forces are closing in on the Donetsk Oblast city the administration head Serhii Dobriak told Radio Free EuropeRadio Liberty RFERL on Aug 19Read todays full report herePhoto Roman Pilipey  AFP via Getty Images,,1659203053,5299,4
36649,2024-08-19T21:19:05+00:00,Kyiv didnt disclose preparations for Kursk operation because of Wests fear of Russian red lines Zelensky saysThat is why actually no one knew about our preparations President Volodymyr Zelensky said on Aug 19,,1659203053,5141,7
36648,2024-08-19T19:51:10+00:00,Ukraine may join NATO despite being partially occupied by Russia Czech president saysI dont think that the full regaining of control over the entire territory is a necessary condition for joining NATO If there is a demarcation even of some administrative border we can accept this administrative border as a temporary one and accept Ukraine into NATO on the territory it will control at that time Czech President Petr Pavel said,,1659203053,5464,11
36647,2024-08-19T19:30:20+00:00,Nearly 1 million people temporarily exempted from military service Defense Ministry says About 930000 Ukrainians liable for military service are temporarily exempted from military service while their number may reach one million in a week Deputy Defense Minister Ivan Havryliuk said,,1659203053,5258,2
36646,2024-08-19T18:32:56+00:00,Ukraine in control of 92 settlements in Russias Kursk Oblast Zelensky claimsUkrainian forces are in control of 92 settlements and more than 1250 square kilometers of Kursk Oblast in Russia as the incursion into the region continues President Volodymyr Zelensky said on Aug 19The Kyiv Independent could not verify these claims,,1659203053,5227,4
36645,2024-08-19T18:29:21+00:00,Chechen commander says Russian conscripts must fight in Kursk Oblast promises heaven for killedAddressing the conscripts parents Apti Alaudinov the commander of the Chechen Akhmat Regiment fighting for Russia said that Russia is currently under attack by the enemy and everyone must stand the line,,1659203053,5104,2
36644,2024-08-19T17:20:59+00:00,Ukraines buffer zone in Kursk Oblast  heres what you need to knowUkraine aims to establish a buffer zone in Russias Kursk Oblast President Volodymyr Zelensky said on Aug 18 as he outlined some of the strategic aims of the ongoing operationIt is now our primary task in defensive operations overall to destroy as much Russian war potential as possible and conduct maximum counteroffensive actions he said during his daily addressPhoto Kirill Chubotin  UkrinformFuture Publishing via Getty Images,,1659203053,5218,4
36643,2024-08-19T17:05:13+00:00,Denmark announces 115 million military aid package says supplied equipment can be used in Kursk OblastThe package is aimed at meeting both Ukraines shortterm and longterm defense needs The funds will be used to purchase new military equipment from the Ukrainian defense industry and the countrys international partners,,1659203053,4893,6
36642,2024-08-19T16:44:40+00:00,Shares of German arms companies fall amid debate over aid to Ukraine Spiegel saysShares of German arms maker Rheinmetall which have risen 28 over the past two weeks fell 5 on Aug 19 as soon as the markets opened although by midday the decline had been reduced to nearly 3 according to Spiegel,,1659203053,5045,4
36641,2024-08-19T15:54:34+00:00,Ukraine approves Swedish infantry fighting vehicle for military useThe Pansarbandvagn 302 PbV 302 infantry fighting vehicle produced by Swedish Hgglund  Sner has been approved for delivery to Ukraines Armed Forces the Defense Ministry said on Aug 19The entire Swedish stock of PbV 302 vehicles was a part of Stockholms largest tranche of military aid for Ukraine worth 13 billion announced in late May,,1659203053,5118,4
36640,2024-08-19T15:41:12+00:00,Russia willing to participate in South Caucasus peace settlement amid crisis in Ukraine Putin says Putin arrived in Baku for talks with his Azerbaijani counterpart Ilham Aliyev for the first time since the start of Russias fullscale invasion of Ukraine in 2022,,1659203053,5003,1
36639,2024-08-19T14:51:27+00:00,SBU uncovers Russian intelligence network involving Ukrainian law enforcement officerThe intelligence network operated in Mykolaiv Dnipropetrovsk and IvanoFrankivsk oblasts The suspects surveilled the Ukrainian Armed Forces and critical infrastructure facilities,,1659203053,5065,7
36638,2024-08-19T14:29:36+00:00,London says UK support for Ukraine unwavering after Zelensky alleged it slowedLondons support for Ukraine remains unwavering a spokesperson for UK Prime Minister Keir Starmer said on Aug 19 following recent remarks by President Volodymyr ZelenskyThe statement came after Zelensky suggested in his Aug 17 evening address that the UKs real leadership on weapons and politics had slowed down amid Londons hesitation to allow the use of longrange Storm Shadow missiles against targets on Russian soil,,1659203053,5089,4
36637,2024-08-19T14:09:19+00:00,Opinion The hidden toll of Ukraines aid workers demands recognition on World Humanitarian DayRussias war in Ukraine is far from over and the challenges ahead are immense Yet our frontline workers persevere despite the hardships They are not just responding to a crisis  they are laying the groundwork for a future where the people of Ukraine can live in peace and security writes UNFPA Representative Massimo Diana in this oped to commemorate World Humanitarian Day Photo Anatolii Stepanov  AFP,,1659203053,4977,3
36636,2024-08-19T13:14:58+00:00, ProKremlin fake sites spread false claims Democrats plotted to assassinate Trump AFP reportsProKremlin websites masquerading as American news outlets spread incendiary falsehoods ahead of the US presidential election the AFP news agency reported on Aug 19,,1659203053,4849,5
36635,2024-08-19T12:59:41+00:00, Russian attacks on Toretsk Zarichne in Donetsk Oblast kill 4Russian forces attacked Toretsk and Zarichne in Donetsk Oblast on Aug 19 killing four civilians the regional prosecutors office saidRussia targeted Toretsk with artillery killing a 71yearold woman in the yard of her housePhoto Donetsk Oblast Prosecutors OfficeFacebook,,1659203053,5032,4
36634,2024-08-19T12:12:55+00:00,Germany delivers IRIST SLS air defense system other aid to UkraineGermany has supplied a new IRIST SLS air defense missile system 14000 rounds of 155 mm ammunition 10 naval drones and other equipment in its latest military aid delivery to Ukraine the German government said on Aug 19,,1659203053,4758,3
36633,2024-08-19T11:51:29+00:00,Governor announces mandatory evacuation of children from PokrovskFamilies with children will be mandatorily evacuated from the Pokrovsk community in Donetsk Oblast as Russian forces approach Governor Vadym Filashkin said on Aug 19More than 53000 people including almost 4000 children still live here but the front has now come too close to Pokrovsk and this warrants an appropriate response Filashkin said on social media,,1659203053,4944,1
36632,2024-08-19T11:34:39+00:00, Kyrgyzstans major bank suspends transfers via sanctioned Russian banksMoney transfers through Russian banks including Sberbank Tinkoff and MTS have been suspended in both directions This service is unavailable indefinitely MBanks statement read,,1659203053,5019,5
36631,2024-08-19T11:13:18+00:00, Kherson Oblast nature reserve damaged but not fully destroyed by Russia director clarifiesThe AskaniaNova Nature Reserve in Kherson Oblast suffered heavily under Russian occupation but has not been fully destroyed as of now the reserves director Viktor Shapoval said in a comment for Suspilne on Aug 19Shapoval was reacting to a statement by Kherson Oblast Governor Oleksandr Prokudin for the media that the reserve effectively ceased to exist because of Russia,,1659203053,5040,4
36630,2024-08-19T10:46:43+00:00, Pokrovsk residents have 2 weeks to evacuate as Russian forces advance authorities sayPokrovsks residents have a week or two to evacuate as Russian forces are closing in on the Donetsk Oblast city the administration head Serhii Dobriak told Radio Free EuropeRadio Liberty RFERL on Aug 19,,1659203053,5013,5
36629,2024-08-19T10:31:19+00:00,Finnish expolitician killed fighting as volunteer in UkraineFinnish volunteer fighter Ville Mykkanen who decided to join Ukraines army in the fall of 2023 was killed in action in Luhansk Oblast the media outlet YLE reported on Aug 18 citing a Finnish mental health association Sodan Kokeneet that supports combat veterans,,1659203053,5096,4
36628,2024-08-19T09:52:11+00:00,Ukraine hits 3rd bridge in Kursk Oblast Russia claimsUkrainian forces hit the third bridge over the Seim River in Russias Kursk Oblast an official of the Russian Investigative Committee claimed in a video published on Aug 19The Ukrainian military is yet to confirm the claims,,1659203053,5093,9
36627,2024-08-19T08:49:28+00:00, Syrskyi considered several scenarios for Russia incursion Economist reportsUkraines CommanderinChief Oleksandr Syrskyi was considering an attack against Russias Bryansk Oblast as an alternative to the Kursk incursion The Economist reported on Aug 18 citing military sources,,1659203053,5069,7
36626,2024-08-19T08:41:47+00:00,Explosion at petrochemical plant in Russias Bashkortostan injures 3An explosion at the Sterlitamak Petrochemical Plant in Russias Bashkortostan Republic on the morning of Aug 19 injured at least three people municipal authorities reported,,1659203053,4962,1
36625,2024-08-19T07:33:17+00:00,Russian attacks against Ukraine kill 4 injure 17 over past dayRussian attacks across Ukraine over the past day killed at least four people and injured at least 17 including a child regional authorities reported early on Aug 19Ukrainian air defenses downed all 11 Shahedtype kamikaze drones launched by Moscow overnight from the Kursk and PrimorskoAkhtarsk directions in Russia the Air Force reportedPhoto Donetsk Oblast Governor Vadym FilashkinTelegram,,1659203053,5166,2
36624,2024-08-19T07:22:18+00:00,Indias Foreign Ministry confirms Modis upcoming visit to UkraineIndias Foreign Ministry confirmed on Aug 19 the upcoming visit of Prime Minister Narendra Modi to Ukraine,,1659203053,4804,3
36623,2024-08-19T06:28:38+00:00,Russia labels George Clooneys foundation undesirableThe Clooney Foundation for Justice CFJ founded by Hollywood actor George Clooney has been declared an undesirable organization Russias Prosecutor Generals Office said on Aug 19,,1659203053,4944,4
36622,2024-08-19T06:13:10+00:00,Energy equipment fire causes outages in Russian town railroad section in SiberiaA fire broke out at a power substation near a railroad station in Russias Kemerovo Oblast in Siberia causing outages in the town of Mariinsk local authorities reported on Aug 19The outages also affected a section of the Krasnoyarsk railroad According to Russian prosecutors the preliminary investigation points to technical malfunction as a cause,,1659203053,5082,3
36621,2024-08-19T06:05:36+00:00,These are the indicative estimates of Russias combat losses as of Aug 19 according to the Armed Forces of Ukraine,,1659203053,5130,12
36620,2024-08-19T04:21:41+00:00,Ukraine downs all 11 Russian drones launched overnightUkrainian air defense shot down all 11 of the Shahedtype attack drones that were launched by Russia overnight on Aug 20 the Air Force reported,,1659203053,5030,4
36619,2024-08-19T03:32:02+00:00,Putin arrives in Azerbaijan for first state visit since fullscale invasion beganRussian President Vladimir Putin arrived in Baku on Aug 18 for a twoday visit for talks with his Azerbaijani counterpart Ilham Aliyev The trip marks Putins first visit to the capital since Russia launched its fullscale invasion of Ukraine in February 2022,,1659203053,5154,6
36618,2024-08-19T01:57:51+00:00,Incursion into Kursk Oblast could change the tide for Ukraine US Senator saysDuring an interview on CBS Face the Nation on Aug 18 US Senator Mark Kelly said that Ukraines incursion into Kursk Oblast could help Ukraine change the course of the war in the countrys favorReferring to Ukraines incursion into Kursk Oblast Kelly said that he believes the Ukrainians have done something unforeseeable that could really change the tide of how this conflicts gonna play out noting that over 130000 Russians have been forced to evacuate regions near the borderWhen asked if the Arizona Senator was comfortable with Ukraine using USprovided weapons in Kursk Oblast Kelly replied I am at this point,,1659203053,5304,8
36617,2024-08-18T23:31:18+00:00,Russia denies reported indirect negotiations with Ukraine to halt energy strikesRussian Foreign Ministry Spokesperson Maria Zakharova denied on Aug 18 a report that the country was entering indirect talks with Ukraine in Qatar on mutually halting strikes on energy infrastructureThe Washington Post WP reported on Aug 17 citing undisclosed official sources that Russia was preparing to enter secret indirect talks with Ukraine  facilitated by Qatar  to mutually stop attacks on energy infrastructure According to the WP Ukraines incursion into Russia disrupted plans for those indirect talksIn response to the report Zakharova claimed that no one broke anything off because there was nothing to break offThere have been no direct or indirect negotiations between Russia and the Kyiv regime on the safety of civilian critical infrastructure facilities Zakharova said,,1659203053,5328,5
36616,2024-08-18T22:25:02+00:00,Russian attack on Bilopillia in Sumy Oblast kills 1 injures 3Russian forces attacked civilian infrastructure in the town of Bilopillia in Sumy Oblast on Aug 18 killing one person and injuring three others including an 11yearold girl the Sumy Oblast Prosecutors Office reported,,1659203053,5218,3
36615,2024-08-18T21:31:58+00:00,Ukraine war latest Ukrainian forces reportedly destroy another key bridge in Kursk Oblast strengthen positionsA second key bridge has been destroyed in Russian Kursk Oblast by Ukrainian forces operating there Air Force Commander Mykola Oleshchuk said on Aug 18Russian Telgram channels claimed that the bridge in question was over the Seim River near the village of Zvannoye It also claimed USsupplied HIMARS missiles were used in the attackPhoto Kostiantyn LiberovLibkos,,1659203053,5520,5
36614,2024-08-18T21:03:16+00:00,Ukraine aims to create buffer zone in Kursk Oblast destroy as much Russian war potential as possible Zelensky saysIn his address President Volodymyr Zelensky also said that the coming weeks will be crucial for our diplomatic efforts with various partners in Europe America and the Global South,,1659203053,5608,5
36613,2024-08-18T20:13:35+00:00,Russian nuclear giant Rosatom directed additional income through Dutch subsidiary Rosatom the Russian state nuclear energy company uses a Dutch subsidiary to move hundreds of millions in profits Dutch news outlet NOS reported citing a report from Uranium One Cooperative,,1659203053,5763,7
36612,2024-08-18T18:24:42+00:00,Russian attacks on Donetsk Oblast kill 4 injure 4 moreRussian troops attacked different settlements in Donetsk Oblast killing four people and injuring four more on Aug 18 Donetsk Oblast Prosecutors Office reported,,1659203053,5804,3
36611,2024-08-18T16:23:52+00:00, Ukraine to resume scheduled blackouts after 3week break says state grid operatorScheduled blackouts will resume across Ukraine on Aug 19 for the first time in three weeks the state grid operator Ukrenergo announced on Aug 18 The renewed blackouts are due to increased electricity consumption amid hot weather Ukrenergo said on its Telegram channel,,1659203053,5996,14
36610,2024-08-18T15:34:21+00:00, German Foreign Ministry refutes claims that Berlin will not provide Kyiv with assistance next year The German Foreign Ministry refuted claims that Berlin will not provide Kyiv with assistance next year Suspilne media outlet reported on Aug 18Germanys bilateral assistance to Ukraine will be gradually redirected toward international programs in the future the German Finance Ministry clarified,,1659203053,6050,9
36609,2024-08-18T14:57:54+00:00, Russia used over 40 missiles 750 guided bombs against Ukraine this week Zelensky says Russia has launched 40 missiles 750 guided aerial bombs and 200 combat drones against Ukrainian cities and villages over the past week President Volodymyr Zelensky said on Aug 18Russia always knows where its missiles and bombs hit  this is deliberate targeted terror Zelensky wrote on his Telegram channel,,1659203053,6122,3
36607,2024-08-18T11:36:10+00:00, Belarus moved third of its army to Ukraine border due to what Lukashenko claims was a misunderstandingLukashenko said he later managed to speak to Ukrainian officials through special channels and the situation was resolved through diplomatic means,,1659203053,6261,11
36606,2024-08-18T09:47:30+00:00, With Nord Stream making headlines again Donald Tusk tells its patrons to apologize and keep quietPoland has come under particular scrutiny in recent days over the act of sabotage which is still being investigated by Germany,,1659203053,6323,3
36605,2024-08-18T08:35:12+00:00, Another key bridge destroyed in Kursk Oblast Ukraine claimsIt would be the second key bridge destroyed by Ukrainian forces in recent days and will further hinder Russias ability to resupply troops hoping to fend off Ukraines incursion,,1659203053,6334,7
36604,2024-08-18T07:03:31+00:00, Kyiv repels Russian aerial attack North Korean ballistic weapons used in strike city authorities sayNo damage or casualties have been reported in the capital,,1659203053,6306,7
36602,2024-08-18T03:51:00+00:00,Putin gives relative promotion in Russian Defense Ministry Anna Tsyvilova has been sanctioned by both the United Kingdom and the European Union over her connections to Putin and her support for the invasion of Ukraine,,1659203053,6308,2
36601,2024-08-18T03:48:54+00:00,Drone hits oil depot in Russias Rostov Oblast A fire broke out at an oil depot in the city of Proletarsk in Russias Rostov Oblast following a drone strike overnight on Aug 18 Governor Vasily Golubev reported,,1659203053,6298,2
36600,2024-08-18T02:07:48+00:00,Explosions reported in KyivExplosions were heard in Kyiv at around 5 am local time Suspilne reported on Aug 18 The Air Force issued an aerial alert in the region due to the threat of Russian drones and missiles,,1659203053,6278,7
36599,2024-08-18T01:54:37+00:00,3 Ukrainians suspected of port arson in Croatia Croatian police are searching for three Ukrainian citizens suspected of setting multiple ships on fire at the Medulin port on the Istrian peninsula The May 14 fire reportedly destroyed 22 vessels and caused over 2 million in damage,,1659203053,6134,7
36598,2024-08-18T00:04:45+00:00,Kadyrov praises Musk says he will send Tesla Cybertruck to fight in Ukraine I had the pleasure of testing the new technology and saw for myself that it is not by chance that it is called Cyberbeast  I am sure this beast will be of great use to our fighters Chechen warlord Ramzan Kadyrov said on Aug 17,,1659203053,6180,11
36597,2024-08-17T22:41:29+00:00,Italian journalists reporting from Kursk to return home after Moscows threats The RAI news team were the first to publish a foreign media report of Ukraines incursion in Kursk Oblast,,1659203053,6025,5
36596,2024-08-17T21:50:07+00:00,Nuclear safety at Zaporizhzhia plant deteriorating after reported drone strike IAEA warns Nuclear power plants are designed to be resilient against technical or human failures and external events including extreme ones but they are not built to withstand a direct military attack,,1659203053,6048,4
36595,2024-08-17T21:03:58+00:00,Ukraines Foreign Ministry says reports on Germany halting military aid are manipulation The reports that Germany is allegedly stopping military aid to Ukraine are incorrect Heorhy Tykhyi a spokesman for Ukraines Foreign Ministry told Ukrainian news agency Ukrinform This is the same kind of manipulation as the previous reports about halving aid for the next year,,1659203053,6628,10
36594,2024-08-17T18:38:02+00:00,Cyberattack hits Monobank Ukraines largest direct bankYesterday it subsided at 1030 pm and today it started again at 315 am We are approaching 3 billion service requests in two days said Oleh Horokhovskyi the banks coowner on Aug 17,,1659203053,5907,7
