id,date,message,from_id,chat_id,views,forwards
36268,2024-08-07T18:17:03+00:00,Ukraine Business Roundup  US banks are cutting off Ukrainian startupsMercury is a USbased fintech firm that provides banking services specifically focusing on the startup market It was a goto for many firms with Ukrainian founders based both inside Ukraine and abroad At the end of July many of those firms were unceremoniously debankedHungary wont experience any oil shortages due to Ukraines decision to tighten sanctions and effectively block the transit of Russias Lukoil crude through the Druzhba pipeline CEO of refiner Mol Nyrt said on Aug 5Read the full digest herePhoto Mercury Bank Instagram,,1659203053,4983,4
36267,2024-08-07T17:42:46+00:00,Vance says he wont even take calls from Ukraine in leaked texts Washington Post reportsRepublican vice presidential nominee JD Vance repeatedly disparaged Ukraine and voiced his unwillingness to continue US support in leaked text messages with farright conspiracy theorist Charles Johnson the Washington Post reported on Aug 7,,1659203053,4948,12
36266,2024-08-07T17:36:58+00:00,US reaching out to Ukraine over reports of Kursk region incursion White House says US officials are reaching out to their Ukrainian counterparts to get a little better understanding of the situation in Russias Kursk region where clashes between Russian and Ukrainian forces are currently taking place US National Security Council spokesperson John Kirby told reporters on Aug 7,,1659203053,5631,7
36265,2024-08-07T17:03:46+00:00,Putin meets top Russian officials over Kursk region situation as more battles reported Russian prowar Telegram channels claimed that fighting was ongoing in the regions towns of Sudzha and Korenevo writing that the Russian military has retreated from the Sudzha gas metering station which transits gas to Europe through Ukraine,,1659203053,5193,9
36264,2024-08-07T15:43:57+00:00,Sumy Oblast announces mandatory evacuation for 6000 residents as Russia intensifies attacks amid Kursk incursion Over the past day Moscows troops have increased aviation activity near the border areas of Sumy Oblast dropping about 30 guided aerial bombs on the settlements Ukraines General Staff said in its latest update,,1659203053,5585,13
36263,2024-08-07T14:28:15+00:00,Russian sailing frigate docks in French port despite sanctions AFP reportsFrance allowed the Russian sailing frigate Shtandart to dock in its port despite EU sanctions over Moscows fullscale invasion of Ukraine AFP reported on Aug 7 citing an unnamed port sourceThe vessel arrived in the port city of La Rochelle overnight on Aug 6 to replenish supplies and refuel the source told AFP The same day in the afternoon the Standart departed in an unclear direction the news agency reported,,1659203053,5312,4
36262,2024-08-07T11:50:52+00:00, Canoeist forced to hide I am Ukrainian inscription during Olympics sponsor saysUkraines canoeist Anastasiia Rybachok was forced to paint over an inscription I am Ukrainian she had displayed on her boat during the Paris Olympics Rybachoks sponsor BGV Group Management said on Aug 7Photo BGV Group ManagementFacebook,,1659203053,5328,4
36261,2024-08-07T11:50:23+00:00,Putin calls clashes in Russias Kursk region largescale provocationRussian President Vladimir Putin claimed that the actions of the Ukrainian military in the Kursk region were a largescale provocation at a meeting with government members on Aug 7Moscow claimed that Ukrainian forces crossed the border into the Kursk region on Aug 6 resulting in clashes on Russian soil Kyiv has not commented on the fighting in the area,,1659203053,4943,11
36260,2024-08-07T11:14:28+00:00, Azov soldier Ishchenko died in Russian captivity due to blunt force trauma report showsAzov Brigade soldier Oleksandr Ishchenko died in Russian captivity due to blunt force trauma to his chest according to a forensic report published by the Azov deputy commander Sviatoslav Palamar on Aug 7Palamar called Ishchenkos death another brutal murder of a Ukrainian POW,,1659203053,4947,6
36259,2024-08-07T10:54:36+00:00, Ukrainian FPV drone hit Russian Mi28 helicopter in historic feat source saysA Ukrainian firstpersonview FPV drone hit a Russian Mi28 attack helicopter over Russias Kursk Oblast on Aug 6 a source in intelligence services told the Kyiv IndependentThe drone operated by the Special Operations Center A of the Security Service of Ukraine SBU managed to hit the helicopters tail rotor the source said calling it a unique special operation in military historyPhoto Artem KatranzhiWikimedia Commons,,1659203053,4885,16
36258,2024-08-07T10:03:45+00:00, Russian offensive expected to wind down within 2 months Budanov saysThe main pressure of Russias offensive should come to a close within one and a half or two months Ukraines military intelligence HUR chief Kyrylo Budanov said in comments reported by Forbes Ukraine on Aug 7,,1659203053,4609,6
36257,2024-08-07T08:58:16+00:00,Ukraine Zambia sign memorandum on political consultationsUkrainian Foreign Minister Dmytro Kuleba signed a memorandum on political consultations with his Zambian counterpart Mulambo Haimbe Ukraines Foreign Ministry said on Aug 6Photo Foreign Minister Dmytro Kuleba  X,,1659203053,4729,3
36256,2024-08-07T08:47:52+00:00, Russian attacks across Ukraine kill 3 injure 14 over past dayRussian attacks against Ukraine killed at least three and injured 14 people over the past day regional authorities reported early on Aug 7A total of 13 Ukrainian oblasts came under Russian attacks  Kyiv Vinnytsia Sumy Cherkasy Mykolaiv Chernihiv Luhansk Khmelnytskyi Dnipropetrovsk Kharkiv Kherson Zaporizhzhia and Donetsk Casualties were reported in the latter five regionsPhoto Donetsk Oblast Governor Vadym FilashkinTelegram,,1659203053,4628,6
36255,2024-08-07T08:43:27+00:00, Germany to receive 480 million worth of Patriot missiles to backfill Ukraine aidThe US defense contractor Raytheon was granted a 478million contract by the NATO Support and Procurement Agency NSPA to supply GEMT missile interceptors to Germany the company said on Aug 6The contract is meant to help replace the Patriot missiles Germany provided to Ukraine,,1659203053,4502,4
36254,2024-08-07T07:27:55+00:00, Nigeria detains tailors who made Russian flags for antigovernment protestsNigeria has detained several tailors for making Russian flags that were used during antigovernment protests in the countrys northern states Reuters reported on Aug 6 citing law enforcement authorities,,1659203053,4593,5
36253,2024-08-07T07:08:41+00:00, Ukrainian special forces raid Russianoccupied island in Black SeaUkrainian special forces destroyed Russian equipment personnel and fortifications during a raid of Tendra Spit off the coast of the occupied part of Kherson Oblast Ukraines military intelligence service said on Aug 7Video HURTelegram,,1659203053,4651,15
36252,2024-08-07T06:38:01+00:00, Kyiv denies Russian claims of capturing NiuYork in Donetsk OblastA Ukrainian official on Aug 6 denied that Russia fully captured the village of NiuYork in Donetsk Oblast saying that heavy fighting continues thereThe frontline settlement of NiuYork lies just south of Toretsk a town that has become one of the focal points of the Russian offensive in Donetsk Oblast,,1659203053,4585,6
36251,2024-08-07T05:58:21+00:00, Another Russian exdefense official arrested on corruption chargesVladimir Demchik a former head of the Property Department of the Russian Defense Ministry was arrested on corruption charges the Russian Investigative Committee reported on Aug 6,,1659203053,4717,3
36250,2024-08-07T05:24:10+00:00,These are the indicative estimates of Russias combat losses as of Aug 7 according to the Armed Forces of Ukraine,,1659203053,4861,9
36249,2024-08-07T04:12:42+00:00,Mexico invites Putin to its presidential inauguration Russian media reports Mexico has invited Russian leader Vladimir Putin to attend the Oct 1 inauguration of Presidentelect Claudia Sheinbaum Russias Izvestia newspaper reported on Aug 7 citing the Mexican embassy in Russia,,1659203053,5064,10
36248,2024-08-07T01:26:09+00:00,Russian officials say 5 civilians killed 20 injured in fighting across border in Kursk Oblast Acting governor Alexei Smirnov reported via his official Telegram page that five civilians including two ambulance crew members were killed and at least 20 were wounded as a result of a crossborder incursion into Russias Kursk Oblast,,1659203053,4891,6
36246,2024-08-06T23:29:16+00:00,Lawmaker Beleniuk to start his last Olympic run aiming for backtoback goldWinning Ukraines only gold medal at the Tokyo Olympics in 2021 was a perfect ending to a stunning career Yet as he says it now Russias allout war pulled the lawmaker back to the wrestling matRead the full story herePhoto Maddie MeyerGetty Images,,1659203053,5031,3
36245,2024-08-06T22:53:56+00:00,Harris Walz officially certified as Democratic nominees in 2024 election US Vice President Kamala Harris and Minnesota Governor Tim Walz have officially been certified as the Democratic partys nominees for president and vice president in the November election following a roll call vote of convention delegates,,1659203053,4800,2
36244,2024-08-06T21:27:41+00:00,Niger joins Mali in breaking diplomatic ties with Ukraine The West African nation of Niger is severing diplomatic relations with Ukraine two days after neighboring Mali made a similar announcement following reports of rebel clashes with Wagner mercenaries,,1659203053,5189,6
36243,2024-08-06T20:45:34+00:00,Russian helicopter tanks reportedly destroyed in fighting across border in Kursk OblastThe crowdsourced monitoring website DeepState shared pictures on Aug 6 appearing to show a downed Russian Ka52 attack helicopter and two destroyed tanks amid reports of a crossborder incursion into Kursk OblastEarlier Ukrainian authorities in Sumy Oblast said that troops in the area had downed a Russian helicopter two drones and a ballistic missile,,1659203053,4851,10
36242,2024-08-06T20:21:55+00:00,Ukraine war latest Moscow claims clashes with Ukrainian troops on Russian soilRussias Defense Ministry claimed that Ukrainian soldiers broke into the territory of Russias Kursk region on Aug 6Russias Defense Ministry claimed around 5 pm local time that up to 300 soldiers of Ukraines 22nd Separate Mechanized Brigade equipped with tanks and armored vehicles had allegedly attacked Russian units near the border settlements of NikolaevoDarino and Oleshnya in the Kursk regionRead todays full report herePhoto Olga MaltsevaAFP via Getty Images,,1659203053,4864,11
36241,2024-08-06T19:28:30+00:00,Putin asks Iran for measured response against Israel sources tell ReutersRussian President Vladimir Putin asked Irans Supreme Leader Ayatollah Ali Khamenei for a controlled retaliation against Israel Reuters reported on Aug 6 citing two senior Iranian officials,,1659203053,4584,4
36240,2024-08-06T18:54:15+00:00,ProUkraine lobbying efforts bet on Trump pivot to look tough on PutinThe US election about 90 days away has become more competitive following the recent decision by 81yearold President Joe Biden to not seek reelection in 2024 The stage is now set for a tighter race between the 78yearold Republican nominee and his younger Democratic opponent Vice President Kamala Harris 59Some experts and Ukraine watchers say Trump could now lift his chances by reversing course to look stronger on the world stage than Putin by presenting himself as more capable of helping Ukraine than Harris Read the full story herePhoto Joe RaedleGetty Images,,1659203053,4731,4
36239,2024-08-06T18:17:09+00:00,Ukraine gave a glimpse of its first F16s  what can it tell usAfter more than a year of waiting F16s finally fly in the Ukrainian skiesPresident Volodymyr Zelensky unveiled two of the first USmade fighter jets sporting blueandyellow roundels and a Ukrainian coat of arms in a ceremony on Aug 4 confirming earlier media reportsThe weaponry visible on the two presented F16s suggests they are likely to be used primarily for air defense purposes According to The Telegraph they have already carried out this task in Ukrainian skiesThe AIM120 AMRAAM that The War Zone identified on the F16s is a beyondvisualrange missile with active radar guidance that some believe will be suitable for intercepting Russian tactical bombers terrorizing Ukrainian frontline troopsRead the full analysis herePhoto Vitalii NosachGlobal Images Ukraine via Getty Images,,1659203053,4419,8
36238,2024-08-06T17:58:34+00:00,Estonia charges citizen who wrote for Russian state media with treasonEstonias Public Prosecutors Office has charged Svetlana Burceva an Estonian citizen who wrote for Russian staterun media with treason and violating international sanctions the media outlet ERR reported on Aug 6,,1659203053,4249,4
36237,2024-08-06T17:42:12+00:00,Richard Verma to replace Penny Pritzker as US Special Representative for Ukraines Economic RecoverySpecial Representative Penny Pritzker has been a tireless advocate of Ukraines economic recovery Antony Blinken said in a statement,,1659203053,4317,3
36236,2024-08-06T17:05:20+00:00,Update Russian missile attack on Kharkiv kills 1 injures 12 including infantA Russian missile attack against Kharkiv on Aug 6 killed one person and injured 12 others including an eightmonthold baby President Volodymyr Zelensky said,,1659203053,4376,3
36235,2024-08-06T16:59:22+00:00,Ukraine launched more drones than Russia in July Zelensky claimsUkrainian forces launched more drones in July than Russian troops President Volodymyr Zelensky claimed in his evening address on Aug 6We do not disclose all the details now but our capacity to produce drones is constantly growing and we are working not only with state funding but also with partners to invest in our drone production Zelensky said,,1659203053,4377,7
36234,2024-08-06T16:28:57+00:00,Harris VP pick Governor Tim Walz good news for UkrainePresumptive Democratic presidential candidate and current US Vice President Kamala Harris has selected Minnesota Governor Tim Walz  an outspoken Ukraine supporter   as her running mate for the US presidential elections this fallSince the start of the fullscale invasion Walz has been a vocal advocate for Ukraine in its fight against Russia signing legislation barring state agencies from doing business with Russian and Belarusian companies His state is also home to weapons manufacturers that supply arms critical for Ukraines defenseRead the full story herePhoto Stephen MaturenGetty Images,,1659203053,4357,10
36233,2024-08-06T16:28:45+00:00,Update Moscow claims clashes with Ukrainian troops in Russias Kursk region Kyiv hasnt commentedRussias Defense Ministry claimed that Ukrainian soldiers broke into the territory of Russias Kursk region on Aug 6Russias Defense Ministry claimed around 5 pm local time that up to 300 soldiers of Ukraines 22nd Separate Mechanized Brigade equipped with tanks and armored vehicles had allegedly attacked Russian units near the border settlements of NikolaevoDarino and Oleshnya in the Kursk regionThe Ukrainian military has not commented on these claims which cannot be independently verified,,1659203053,4337,12
36232,2024-08-06T15:34:41+00:00,Russia reportedly begins slowing YouTube speeds amid censorship spat with GoogleRussian authorities have informed the countrys telecom operators that YouTube will be slowed down to 128 kilobytes a second the independent Russian media outlet Meduza reported on Aug 6 citing sources,,1659203053,4375,2
36231,2024-08-06T13:58:43+00:00,Ukraines missile program to get additional funding Zelensky saysUkraine will allocate additional funding for the countrys missile program President Volodymyr Zelensky said on Aug 6The decision was made at the commanderinchief headquarters meeting on Aug 6 Defense Minister Rustem Umerov and Minister for Strategic Industries Alexander Kamyshin briefed the president on the production of Ukrainian drones and missiles,,1659203053,4615,5
36230,2024-08-06T13:41:33+00:00,Harris chooses Minnesota Governor Tim Walz as running mate media reportsDemocratic presidential nominee Kamala Harris has reportedly chosen Minnesota Governor Tim Walz as her choice for vice president on the ticket sources told the New York Times and other media outlets on Aug 6 Harris is expected to make the official announcement later in the day,,1659203053,4458,6
36229,2024-08-06T13:02:31+00:00, Czechia sentences volunteer who fought in Ukraine to 7 years in prison for lootingA court in Czechia on Aug 6 sentenced Czech exsoldier Filip Siman to seven years in prison for looting while fighting in Ukraine as a volunteer CTK news agency reported,,1659203053,4344,5
36228,2024-08-06T12:26:40+00:00, Russias fourth dam bursts in two weeksA dam burst in the town of Dalnerechensk in the far east of Russia overnight on Aug 6 regional authorities told stateowned TASS news agency This marks the fourth such case in Russia in two weeksPhoto Civil Defense and Emergencies Service in Primorsky Krai,,1659203053,4417,10
36227,2024-08-06T11:58:10+00:00,Russian attack on Kherson injures at least 5Russian troops attacked the city of Kherson on Aug 6 injuring at least five people Governor Oleksandr Prokudin reportedA Russian drone dropped explosives on Khersons outskirts Two men aged 53 and 57 as well as three women aged 37 46 and 68 suffered injuries and were hospitalized Prokudin said,,1659203053,4241,2
36226,2024-08-06T11:44:10+00:00, Council of EU approves 46 billion under Ukraine FacilityThe Council of the EU on Aug 6 gave its written approval to disburse 42 billion euros 46 billion to Kyiv as the first regular payment under the Ukraine Facility,,1659203053,4231,2
36225,2024-08-06T11:28:19+00:00, Ukraine boosting gas production thanks to new wells technologiesCompanies of Ukraines stateowned Naftogaz Group produced 86 billion cubic meters bcm of commercial gas in the first seven months of 2024 representing a 7 increase compared to the same period last year the companys press service said on Aug 6,,1659203053,4199,4
36224,2024-08-06T11:24:02+00:00,Opinion Something is rotten in the state of Russian arms industryAfter two years of fullscale invasion the Kremlin reports that Russias arms industry is still able to meet growing domestic demand and continue arms exportsThese statements are seemingly designed to project confidence that Russia can outlast the West At the same time though these messages starkly contrast with more pessimistic assessments appearing in both international and Russian media writes Khrystyna Holynska in this oped Photo ContributorGetty Images,,1659203053,4095,7
36223,2024-08-06T11:05:45+00:00, Ukraines project helps to locate 588 missing Russian soldiersUkraines project Khochu naiti I want to find has helped to locate 588 missing Russian soldiers since its launch in January as reported on the services Telegram channel on Aug 5Some 533 of the Russian soldiers were found alive among prisoners of war POW and 100 of them had already been released to Russia as a part of a prisoner exchange,,1659203053,3899,1
36222,2024-08-06T10:50:50+00:00, Update 8 injured in Russian missile attack on KharkivThe number of injured in a Russian missile attack against Kharkiv on Aug 6 has risen to eight the police reported The victims include an 8monthold child,,1659203053,3951,1
36221,2024-08-06T10:32:23+00:00,Russia claims Ukraine attempted to break into Kursk region Kyiv hasnt commentedAleksey Smirnov the governor of Russias Kursk Oblast claimed that the Ukrainian military tried to break into the territory of the region on Aug 6Russian prowar Telegram channels wrote that a sabotage and reconnaissance group with heavy equipment had allegedly entered Kursk Oblast in the morningThe Ukrainian military has not commented on these claims which cannot be independently verified,,1659203053,4033,7
36220,2024-08-06T10:12:02+00:00, US seeks to confiscate exPM Lazarenkos money for UkraineThe US Justice Department wants to confiscate 200 million from Ukraines exPrime Minister Pavlo Lazarenko in favor of Ukraine Mary Butler the departments senior official said in an interview with the Voice of America published on Aug 5,,1659203053,3876,4
36216,2024-08-06T10:01:56+00:00, Update 5 injured in Russian missile attack on KharkivA Russian missile attack against Kharkiv on Aug 6 injured five people local authorities reportedRussia struck the Shevchenkivskyi city district with an Iskander missile at around 10 am damaging a clinic cars and other civilian infrastructure Governor Oleh Syniehubov saidPhoto Governor Oleh SyniehubovTelegram,,1659203053,3946,2
36215,2024-08-06T09:30:37+00:00, ExSupreme Court head Kniaziev dismissed as judge of Cassation Administrative CourtVsevolod Kniaziev former chairman of Ukraines top judicial body and a suspect in a bribery case was dismissed on Aug 6 from his post as a judge of the Supreme Courts Cassation Administrative CourtThe High Council of Justice justified the decision by a significant disciplinary offense on Kniazievs part,,1659203053,4024,2
36214,2024-08-06T09:17:23+00:00, Arrival of F16s has not changed US policy on Ukrainian strikes inside RussiaThe US policy on Ukrainian strikes deep into Russian territory with American weapons remains unchanged despite the arrival of F16 fighting jets in Ukraine US State Department spokesperson Matthew Miller said during a press briefing on Aug 5,,1659203053,4153,5
36213,2024-08-06T07:38:53+00:00, Russia strikes medical facility in Kharkiv people may be trapped under rubbleRussian forces launched a missile attack against Kharkiv on Aug 6 local authorities reportedThe Russian military struck a residential area in the center of the city causing a fire and damaging a clinic according to Mayor Ihor Terekhov,,1659203053,4225,6
36212,2024-08-06T07:26:07+00:00, Russian attacks across Ukraine kill 3 injure 19 over past dayRussian attacks against Ukraine killed at least three and injured 19 people over the past day regional authorities reported early on Aug 6According to Ukraines Air Force Russia launched 16 Shahedtype drones from Cape Chauda in occupied Crimea and the Russian city of Kursk as well as four Iskander MKN23 ballistic missiles from Russias Voronezh Oblast and two Kh59 guided missiles from the Azov SeaPhoto Donetsk Oblast Governor Vadym Filashkin  Telegram,,1659203053,4371,5
36211,2024-08-06T06:44:20+00:00,These are the indicative estimates of Russias combat losses as of Aug 6 according to the Armed Forces of Ukraine,,1659203053,4550,9
36210,2024-08-06T06:25:15+00:00,Iran asks Russia for air defenses to prepare for potential war with Israel NYT reportsIran has requested modern air defense systems from Russia as it prepares for a possible war with Israel with deliveries already underway the New York Times NYT reports on Aug 5 citing undisclosed Iranian officials,,1659203053,4692,13
36209,2024-08-06T04:01:00+00:00,Explosion reported at military plant in Russia killing 3An explosion reported at an Avangard plant in Bashkortostan Russia killed three people RFERL reported on Aug 5 The plant belongs to Rostec the Russian stateowned arms manufacturer,,1659203053,4812,6
36208,2024-08-05T23:57:02+00:00,Hungarian CEO confident in countrys oil supply despite Ukraines Lukoil transit block Zsolt Hernadi CEO of Hungarian oil and gas conglomerate MOL Group said that Hungary has 90 days of strategic reserves with the option to buy Russian crude via CroatiaEU members have privately voiced exasperation that neither Hungary nor Slovakia have managed to reduce their dependency on Russian oil while many other member states did,,1659203053,4836,6
36207,2024-08-05T22:02:02+00:00,Ukraine war latest Russian Su34 jet destroyed in Ukraines strike on Morozovsk airfield Kyiv saysThe Ukrainian military destroyed a Russian Su34 fighterbomber aircraft and an ammunition depot at the Morozovsk airfield in Russias Rostov OblastAt least four explosions were heard in Kyiv shortly after the air alert sounded at around 11 pm local time on Aug 5Read todays full report herePhoto Mikhail TokmakovSOPA ImagesLightRocket via Getty Images,,1659203053,5099,9
36206,2024-08-05T21:24:05+00:00,Investigation Almost 2 years into first reports of wrongdoing Ukraines International Legion appears immune to changeThis is the third part of the Kyiv Independents investigation into the International Legion  a military formation created for foreign fighters defending Ukraine After investigations by Ukrainian law enforcement and global public attention following Kyiv Independent and other media reports in 20222023 the Legion seems to have not implemented any substantial changesInstead of suspending or firing commanders subject to soldiers complaints the leadership of the Legion either kept them at their posts or transferred them to other unitsCommanders in the military intelligence HUR arm of the Legion continue to abuse subordinates in the ways similar to what the Kyiv Independent reported in 2022Read the full investigation hereIllustration by Karolina Gulshani,,1659203053,4628,15
36205,2024-08-05T20:39:50+00:00,Opinion The path to peace in EuropeThe path to peace is as clear today as it was ten years ago a firm stance of the collective West backed by decisive actions to disabuse Moscow of its imperial ambitions writes Andrew Chakhoyan in this guest oped What if Russia lost the war Let us not fall into the Kremlins narrative trap no one invaded Russia When we commit to Ukraines victory and help this freedomloving nation restore its sovereignty Moscow will have lost nothingRead the full oped here Photo Chris McGrathGetty Images,,1659203053,4660,5
